{
  "schema": "facman.alpha_tag_ruleset_observation.v1",
  "work_unit": "FACMAN-ALPHA-TAG-ELIGIBILITY-PRODUCER-01",
  "repository": "Julesc013/factorio-launcher",
  "observer": {
    "windows_identity": "BLACKGLASS-WIN1\\Jules",
    "github_login": "Julesc013"
  },
  "observed_at": "2026-08-29T07:47:36.308Z",
  "evidence": {
    "source": "authenticated_github_rest_api",
    "endpoint": "repos/Julesc013/factorio-launcher/rulesets/21787868",
    "bypass_actor_visibility": "ruleset_write_user_context"
  },
  "ruleset": {
    "id": 21787868,
    "name": "FacMan immutable alpha tags",
    "target": "tag",
    "source_type": "Repository",
    "source": "Julesc013/factorio-launcher",
    "enforcement": "active",
    "conditions": {
      "ref_name": {
        "include": [
          "refs/tags/v0.1.0-alpha.*"
        ],
        "exclude": []
      }
    },
    "rules": [
      {
        "type": "deletion"
      },
      {
        "type": "update"
      }
    ],
    "node_id": "RRS_lACqUmVwb3NpdG9yec5NE4M0zgFMdNw",
    "created_at": "2026-08-29T16:07:38.330+10:00",
    "updated_at": "2026-08-29T16:07:38.348+10:00",
    "bypass_actors": [],
    "current_user_can_bypass": "never"
  },
  "authority": {
    "tag_creation": false,
    "publication": false,
    "signing": false,
    "route_effects": false,
    "support_activation": false,
    "human_verdict": false
  }
}
